"DESCRIPTION","DURATION IN MS","NAME","PARENT SUITE","START TIME","STATUS","STOP TIME","SUB SUITE","SUITE","TEST CLASS","TEST METHOD"
"","221","User can open Main page","","Wed Dec 03 11:48:47 UTC 2025","passed","Wed Dec 03 11:48:47 UTC 2025","","","",""
"","178","User can open Careers page","","Wed Dec 03 11:48:45 UTC 2025","passed","Wed Dec 03 11:48:46 UTC 2025","","","",""
"","4435","User can open About page","","Wed Dec 03 08:21:04 UTC 2025","passed","Wed Dec 03 08:21:08 UTC 2025","","","",""
"","330","User can open About page","","Wed Dec 03 11:48:45 UTC 2025","passed","Wed Dec 03 11:48:45 UTC 2025","","","",""
"","161","User can open Services page","","Wed Dec 03 11:48:47 UTC 2025","passed","Wed Dec 03 11:48:47 UTC 2025","","","",""
"","174","User can open Insights page","","Wed Dec 03 11:48:46 UTC 2025","passed","Wed Dec 03 11:48:46 UTC 2025","","","",""
